{
  "$id": "urn:bois:schema:object-model:2.31:v2.31_Public_BOIS_Common_Core",
  "$schema": "https://json-schema.org/draft/2020-12/schema",
  "additionalProperties": false,
  "properties": {
    "aliases": {
      "items": {
        "type": "object"
      },
      "type": "array"
    },
    "artifact_version": {
      "const": "2.31"
    },
    "behavior_profiles": {
      "items": {
        "type": "object"
      },
      "type": "array"
    },
    "catalog_schema_ref": {
      "type": "string"
    },
    "component_revision": {
      "type": "string"
    },
    "component_semantics_version": {
      "type": "string"
    },
    "instance_schema_ref": {
      "type": "string"
    },
    "model_id": {
      "type": "string"
    },
    "objects": {
      "items": {
        "type": "object"
      },
      "type": "array"
    },
    "relation_types_ref": {
      "type": "string"
    },
    "release_id": {
      "const": "v2.31_Public_BOIS_Common_Core"
    },
    "schema_version": {
      "type": "string"
    },
    "status": {
      "type": "string"
    }
  },
  "required": [
    "aliases",
    "artifact_version",
    "behavior_profiles",
    "catalog_schema_ref",
    "component_revision",
    "component_semantics_version",
    "instance_schema_ref",
    "model_id",
    "objects",
    "relation_types_ref",
    "release_id",
    "schema_version",
    "status"
  ],
  "type": "object"
}
