{
  "aliases": [
    {
      "alias": "AttentionAllocation",
      "canonical_type": "State",
      "constraint": {
        "allOf": [
          {
            "$ref": "#/$defs/State"
          },
          {
            "properties": {
              "state_kind": {
                "const": "ATTENTION_ALLOCATION"
              }
            },
            "required": [
              "state_kind"
            ]
          }
        ]
      }
    },
    {
      "alias": "ValuableUnknown",
      "canonical_type": "Unknown",
      "constraint": {
        "allOf": [
          {
            "$ref": "#/$defs/Unknown"
          },
          {
            "properties": {
              "value_status": {
                "const": "VALUABLE"
              }
            },
            "required": [
              "value_status"
            ]
          }
        ]
      }
    },
    {
      "alias": "NextStep",
      "canonical_type": "Transition",
      "constraint": {
        "allOf": [
          {
            "$ref": "#/$defs/Transition"
          },
          {
            "properties": {
              "candidate_status": {
                "const": "PROPOSED"
              }
            },
            "required": [
              "candidate_status"
            ]
          }
        ]
      }
    },
    {
      "alias": "PhysiologyRevisionCandidate",
      "canonical_type": "Revision",
      "constraint": {
        "allOf": [
          {
            "$ref": "#/$defs/Revision"
          },
          {
            "properties": {
              "activation_status": {
                "const": "CANDIDATE"
              }
            },
            "required": [
              "activation_status"
            ]
          }
        ]
      }
    },
    {
      "alias": "Experience",
      "canonical_type": "ExperienceRecord",
      "constraint": {
        "allOf": [
          {
            "$ref": "#/$defs/ExperienceRecord"
          }
        ]
      }
    },
    {
      "alias": "ResearchProtocol",
      "canonical_type": "Protocol",
      "constraint": {
        "allOf": [
          {
            "$ref": "#/$defs/Protocol"
          },
          {
            "properties": {
              "purpose": {
                "const": "RESEARCH"
              }
            },
            "required": [
              "purpose"
            ]
          }
        ]
      }
    },
    {
      "alias": "IndependentReview",
      "canonical_type": "Evidence",
      "constraint": {
        "allOf": [
          {
            "$ref": "#/$defs/Evidence"
          },
          {
            "properties": {
              "independence": {
                "enum": [
                  "IND2",
                  "IND3",
                  "IND4"
                ]
              }
            },
            "required": [
              "independence"
            ]
          }
        ]
      }
    },
    {
      "alias": "Substrate",
      "canonical_type": "SubstrateDeclaration",
      "constraint": {
        "allOf": [
          {
            "$ref": "#/$defs/SubstrateDeclaration"
          }
        ]
      }
    }
  ],
  "artifact_version": "2.31",
  "behavior_profiles": [
    {
      "profile_id": "GENERIC_STATEFUL_OBJECT",
      "purpose": "General typed lifecycle with explicit state, transition owner, HOLD, repair, and closure."
    },
    {
      "profile_id": "EPISTEMIC_OBJECT",
      "purpose": "Epistemic object with provenance, evidence status, uncertainty, and revision boundaries."
    },
    {
      "profile_id": "EFFECT_RECORD_OBJECT",
      "purpose": "Observed or captured effect linked to execution, evidence, cycle, and state update."
    },
    {
      "profile_id": "PROCESS_OBJECT",
      "purpose": "Process or protocol run with declared input, output, owner, route, and terminal status."
    },
    {
      "profile_id": "MACHINE_OBJECT",
      "purpose": "Machine-level object with constitutional ownership, interfaces, invariants, and lifecycle."
    },
    {
      "profile_id": "ACTION_OBJECT",
      "purpose": "Authorized action with scope, executor, risk, reversibility, and effect capture."
    },
    {
      "profile_id": "ACTION_PROPOSAL_OBJECT",
      "purpose": "Proposal separated from authorization, execution, and effect."
    },
    {
      "profile_id": "PHASE_OBJECT",
      "purpose": "C00-C11 or external phase object with gate, evidence, owner, and transition contract."
    },
    {
      "profile_id": "TRAJECTORY_OBJECT",
      "purpose": "Trajectory with ordered state transitions, protected invariants, and closure criteria."
    }
  ],
  "catalog_schema_ref": "schema/OBJECT_MODEL_CATALOG_SCHEMA.json",
  "component_revision": "2",
  "component_semantics_version": "2.31",
  "instance_schema_ref": "schema/OBJECT_INSTANCE_SCHEMA.json",
  "model_id": "BOIS-OBJECT-MODEL-2.31",
  "objects": [
    {
      "allowed_states": [
        "CANDIDATE",
        "DEFINED",
        "IN_USE",
        "SUPERSEDED"
      ],
      "allowed_transitions": [
        {
          "from": "CANDIDATE",
          "owner": "O005",
          "to": "DEFINED"
        },
        {
          "from": "DEFINED",
          "owner": "O005",
          "to": "IN_USE"
        },
        {
          "from": "IN_USE",
          "owner": "O005",
          "to": "SUPERSEDED"
        }
      ],
      "artifact_version": null,
      "base_profile_id": "EPISTEMIC_OBJECT",
      "catalog_integrity_sha256": "81bd795207dbe659590a3d1869fc08cfafc1a2baede2bf150a68c00f52788c28",
      "field_types": {
        "category_id": [
          "string"
        ],
        "definition": [
          "string"
        ],
        "invariants": [
          "array"
        ],
        "owner": [
          "string"
        ],
        "scope": [
          "string"
        ]
      },
      "initial_state": "CANDIDATE",
      "object_type": "AbstractCategory",
      "owner": "O005",
      "relations": [
        "PART_OF:PhilosophicalMachine"
      ],
      "required_fields": [
        "category_id",
        "definition",
        "scope",
        "owner",
        "invariants",
        "lifecycle_state"
      ],
      "special_contract": {},
      "transition_owner": "O005",
      "type_kind": "CATEGORY",
      "validation_tests": [
        "TEST-OBJECT-ABSTRACTCATEGORY-STRUCTURE",
        "TEST-OBJECT-ABSTRACTCATEGORY-BEHAVIOR"
      ]
    },
    {
      "allowed_states": [
        "CANDIDATE",
        "UP_COMPLETE",
        "TRANSFORMED",
        "DOWN_COMPLETE",
        "HOLD"
      ],
      "allowed_transitions": [
        {
          "from": "CANDIDATE",
          "owner": "O005",
          "to": "UP_COMPLETE"
        },
        {
          "from": "UP_COMPLETE",
          "owner": "O005",
          "to": "TRANSFORMED"
        },
        {
          "from": "TRANSFORMED",
          "owner": "O005",
          "to": "DOWN_COMPLETE"
        },
        {
          "from": "UP_COMPLETE",
          "owner": "O005",
          "to": "HOLD"
        },
        {
          "from": "TRANSFORMED",
          "owner": "O005",
          "to": "HOLD"
        }
      ],
      "artifact_version": null,
      "base_profile_id": "EPISTEMIC_OBJECT",
      "catalog_integrity_sha256": "59f1f116d211d5c8a25bc6ddfe814e2d98d5d7f4fcb5948b8d8f5352e432f5d3",
      "field_types": {
        "invariants": [
          "array"
        ],
        "non_transferable_claims": [
          "array"
        ],
        "return_route": [
          "string"
        ],
        "selected_features": [
          "string"
        ],
        "source_level": [
          "string"
        ],
        "target_level": [
          "string"
        ],
        "trace_id": [
          "string"
        ]
      },
      "initial_state": "CANDIDATE",
      "object_type": "AbstractionTrace",
      "owner": "O005",
      "relations": [
        "PART_OF:PhilosophicalMachine"
      ],
      "required_fields": [
        "trace_id",
        "source_level",
        "target_level",
        "selected_features",
        "invariants",
        "non_transferable_claims",
        "return_route",
        "lifecycle_state"
      ],
      "special_contract": {},
      "transition_owner": "O005",
      "type_kind": "TRACE",
      "validation_tests": [
        "TEST-OBJECT-ABSTRACTIONTRACE-STRUCTURE",
        "TEST-OBJECT-ABSTRACTIONTRACE-BEHAVIOR"
      ]
    },
    {
      "allowed_states": [
        "NOT_RUN",
        "RUNNING",
        "PASS_INTERNAL_STATIC",
        "HOLD",
        "FAIL",
        "REPAIR_REQUIRED"
      ],
      "allowed_transitions": [
        {
          "from": "NOT_RUN",
          "owner": "O027",
          "to": "RUNNING"
        },
        {
          "from": "RUNNING",
          "owner": "O027",
          "to": "PASS_INTERNAL_STATIC"
        },
        {
          "from": "RUNNING",
          "owner": "O027",
          "to": "HOLD"
        },
        {
          "from": "RUNNING",
          "owner": "O027",
          "to": "FAIL"
        },
        {
          "from": "HOLD",
          "owner": "O027",
          "to": "REPAIR_REQUIRED"
        },
        {
          "from": "FAIL",
          "owner": "O027",
          "to": "REPAIR_REQUIRED"
        }
      ],
      "artifact_version": null,
      "base_profile_id": "GENERIC_STATEFUL_OBJECT",
      "catalog_integrity_sha256": "8119d52c5cfe0becc56b165e8489e52bed617313774018185c61d3a9e8a7773d",
      "field_types": {
        "current_catalog": [
          "object"
        ],
        "mutations": [
          "object"
        ],
        "result": [
          "PASS_INTERNAL_STATIC",
          "HOLD",
          "FAIL"
        ],
        "runtime_authorization": [
          "string"
        ],
        "test_id": [
          "#/$defs/Identifier"
        ]
      },
      "initial_state": "NOT_RUN",
      "object_type": "AcceptanceSelfTestReport",
      "owner": "O027",
      "relations": [],
      "required_fields": [
        "test_id",
        "current_catalog",
        "mutations",
        "result",